{
  "$schema": "./schema.json",
  "id": "koshien_ikebukuro",
  "name": "甲子園池袋店",
  "region": "東京都",
  "area": "池袋",
  "sheet_store_name": "甲子園池袋店",
  "updated_at": "2026-09-25",
  "sources": [
    {
      "id": "s1",
      "name": "みんぱち 甲子園池袋店",
      "url": "https://minpachi.com/%e7%94%b2%e5%ad%90%e5%9c%92%e6%b1%a0%e8%a2%8b%e5%ba%97/",
      "reliability": "ポータル",
      "checked_at": "2026-09-25"
    }
  ],
  "info": {
    "city": {
      "value": "豊島区",
      "status": "未確認",
      "source_ids": [
        "s1"
      ]
    },
    "address": {
      "value": "東京都豊島区西池袋1-22-8",
      "status": "未確認",
      "source_ids": [
        "s1"
      ]
    },
    "phone": {
      "value": null,
      "status": "不明",
      "source_ids": []
    },
    "hours": {
      "value": "10:00〜22:50",
      "status": "未確認",
      "source_ids": [
        "s1"
      ]
    },
    "entry": {
      "value": [
        "整理券あり（会員カード不要）",
        "配布方法: 抽選",
        "配布時間: 9:50"
      ],
      "status": "未確認",
      "source_ids": [
        "s1"
      ]
    },
    "total_units": {
      "value": null,
      "status": "不明",
      "source_ids": []
    },
    "pachinko_units": {
      "value": null,
      "status": "不明",
      "source_ids": []
    },
    "slot_units": {
      "value": 141,
      "status": "未確認",
      "source_ids": [
        "s1"
      ]
    },
    "rates": {
      "value": [
        "スロット 21.73円"
      ],
      "status": "未確認",
      "source_ids": [
        "s1"
      ]
    },
    "exchange_rates": {
      "value": [
        "21.73円スロット 5.26枚"
      ],
      "status": "未確認",
      "source_ids": [
        "s1"
      ]
    },
    "replay_limit": {
      "value": null,
      "status": "不明",
      "source_ids": []
    },
    "prize_exchange": {
      "value": "カウンター側出入り口を出て左側、飲食店を挟んで5m程度の並び",
      "status": "未確認",
      "source_ids": [
        "s1"
      ]
    },
    "parking": {
      "value": null,
      "status": "不明",
      "source_ids": []
    },
    "access": {
      "value": null,
      "status": "不明",
      "source_ids": []
    },
    "official_url": {
      "value": null,
      "status": "不明",
      "source_ids": []
    },
    "sns": {
      "value": null,
      "status": "不明",
      "source_ids": []
    },
    "line": {
      "value": null,
      "status": "不明",
      "source_ids": []
    },
    "opened_on": {
      "value": null,
      "status": "不明",
      "source_ids": []
    },
    "features": {
      "value": null,
      "status": "不明",
      "source_ids": []
    },
    "installed_machines": {
      "value": null,
      "status": "不明",
      "source_ids": []
    },
    "event_days": {
      "value": "5のつく日",
      "status": "未確認",
      "source_ids": [
        "s1"
      ]
    },
    "anniversary_days": {
      "value": null,
      "status": "不明",
      "source_ids": []
    },
    "special_days": {
      "value": null,
      "status": "不明",
      "source_ids": []
    },
    "new_machines": {
      "value": null,
      "status": "不明",
      "source_ids": []
    },
    "notices": {
      "value": null,
      "status": "不明",
      "source_ids": []
    }
  },
  "history": [
    {
      "field": "city",
      "before": null,
      "after": "豊島区",
      "changed_at": "2026-09-25",
      "source_ids": [
        "s1"
      ]
    },
    {
      "field": "address",
      "before": null,
      "after": "東京都豊島区西池袋1-22-8",
      "changed_at": "2026-09-25",
      "source_ids": [
        "s1"
      ]
    },
    {
      "field": "hours",
      "before": null,
      "after": "10:00〜22:50",
      "changed_at": "2026-09-25",
      "source_ids": [
        "s1"
      ]
    },
    {
      "field": "entry",
      "before": null,
      "after": [
        "整理券あり（会員カード不要）",
        "配布方法: 抽選",
        "配布時間: 9:50"
      ],
      "changed_at": "2026-09-25",
      "source_ids": [
        "s1"
      ]
    },
    {
      "field": "slot_units",
      "before": null,
      "after": 141,
      "changed_at": "2026-09-25",
      "source_ids": [
        "s1"
      ]
    },
    {
      "field": "rates",
      "before": null,
      "after": [
        "スロット 21.73円"
      ],
      "changed_at": "2026-09-25",
      "source_ids": [
        "s1"
      ]
    },
    {
      "field": "exchange_rates",
      "before": null,
      "after": [
        "21.73円スロット 5.26枚"
      ],
      "changed_at": "2026-09-25",
      "source_ids": [
        "s1"
      ]
    },
    {
      "field": "prize_exchange",
      "before": null,
      "after": "カウンター側出入り口を出て左側、飲食店を挟んで5m程度の並び",
      "changed_at": "2026-09-25",
      "source_ids": [
        "s1"
      ]
    },
    {
      "field": "event_days",
      "before": null,
      "after": "5のつく日",
      "changed_at": "2026-09-25",
      "source_ids": [
        "s1"
      ]
    }
  ]
}
