{
  "$schema": "./schema.json",
  "id": "rakuen_ameyoko",
  "name": "楽園アメ横店",
  "region": "東京都",
  "area": "上野",
  "sheet_store_name": "楽園アメ横店",
  "updated_at": "2026-10-02",
  "sources": [
    {
      "id": "s1",
      "name": "みんぱち 楽園アメ横店",
      "url": "https://minpachi.com/rakuen-ameyoko/",
      "reliability": "ポータル",
      "checked_at": "2026-10-02"
    }
  ],
  "info": {
    "city": {
      "value": "台東区",
      "status": "未確認",
      "source_ids": [
        "s1"
      ]
    },
    "address": {
      "value": "東京都台東区上野6-9-7",
      "status": "未確認",
      "source_ids": [
        "s1"
      ]
    },
    "phone": {
      "value": null,
      "status": "不明",
      "source_ids": []
    },
    "hours": {
      "value": "10:00〜22:40",
      "status": "未確認",
      "source_ids": [
        "s1"
      ]
    },
    "entry": {
      "value": [
        "整理券あり（会員カード不要）",
        "配布方法: 抽選（9:40）",
        "再整列開始は9:50。パチンコは260名、スロットは450名で打ち切り",
        "パチンコはお店の線路側、スロットは線路側入口から御徒町駅方面へ整列"
      ],
      "status": "未確認",
      "source_ids": [
        "s1"
      ]
    },
    "total_units": {
      "value": null,
      "status": "不明",
      "source_ids": []
    },
    "pachinko_units": {
      "value": 409,
      "status": "未確認",
      "source_ids": [
        "s1"
      ]
    },
    "slot_units": {
      "value": 478,
      "status": "未確認",
      "source_ids": [
        "s1"
      ]
    },
    "rates": {
      "value": [
        "パチンコ 4円 / 1.11円",
        "スロット 21.73円 / 5円"
      ],
      "status": "未確認",
      "source_ids": [
        "s1"
      ]
    },
    "exchange_rates": {
      "value": [
        "4円パチンコ 28玉",
        "1.11円パチンコ 100.9玉",
        "21.73円スロット 5.15枚",
        "5円スロット 22.4枚"
      ],
      "status": "未確認",
      "source_ids": [
        "s1"
      ]
    },
    "replay_limit": {
      "value": null,
      "status": "不明",
      "source_ids": []
    },
    "prize_exchange": {
      "value": "線路側入り口を出て右手すぐ（大きなTUCの看板あり）",
      "status": "未確認",
      "source_ids": [
        "s1"
      ]
    },
    "parking": {
      "value": null,
      "status": "不明",
      "source_ids": []
    },
    "access": {
      "value": null,
      "status": "不明",
      "source_ids": []
    },
    "official_url": {
      "value": null,
      "status": "不明",
      "source_ids": []
    },
    "sns": {
      "value": null,
      "status": "不明",
      "source_ids": []
    },
    "line": {
      "value": null,
      "status": "不明",
      "source_ids": []
    },
    "opened_on": {
      "value": "2023年1月6日",
      "status": "未確認",
      "source_ids": [
        "s1"
      ]
    },
    "features": {
      "value": null,
      "status": "不明",
      "source_ids": []
    },
    "installed_machines": {
      "value": null,
      "status": "不明",
      "source_ids": []
    },
    "event_days": {
      "value": "1日、6日、11日、15日、22日、月日ゾロ目",
      "status": "未確認",
      "source_ids": [
        "s1"
      ]
    },
    "anniversary_days": {
      "value": "1月6日",
      "status": "未確認",
      "source_ids": [
        "s1"
      ]
    },
    "special_days": {
      "value": null,
      "status": "不明",
      "source_ids": []
    },
    "new_machines": {
      "value": null,
      "status": "不明",
      "source_ids": []
    },
    "notices": {
      "value": null,
      "status": "不明",
      "source_ids": []
    }
  },
  "history": [
    {
      "field": "city",
      "before": null,
      "after": "台東区",
      "changed_at": "2026-10-02",
      "source_ids": [
        "s1"
      ]
    },
    {
      "field": "address",
      "before": null,
      "after": "東京都台東区上野6-9-7",
      "changed_at": "2026-10-02",
      "source_ids": [
        "s1"
      ]
    },
    {
      "field": "hours",
      "before": null,
      "after": "10:00〜22:40",
      "changed_at": "2026-10-02",
      "source_ids": [
        "s1"
      ]
    },
    {
      "field": "entry",
      "before": null,
      "after": [
        "整理券あり（会員カード不要）",
        "配布方法: 抽選（9:40）",
        "再整列開始は9:50。パチンコは260名、スロットは450名で打ち切り",
        "パチンコはお店の線路側、スロットは線路側入口から御徒町駅方面へ整列"
      ],
      "changed_at": "2026-10-02",
      "source_ids": [
        "s1"
      ]
    },
    {
      "field": "pachinko_units",
      "before": null,
      "after": 409,
      "changed_at": "2026-10-02",
      "source_ids": [
        "s1"
      ]
    },
    {
      "field": "slot_units",
      "before": null,
      "after": 478,
      "changed_at": "2026-10-02",
      "source_ids": [
        "s1"
      ]
    },
    {
      "field": "rates",
      "before": null,
      "after": [
        "パチンコ 4円 / 1.11円",
        "スロット 21.73円 / 5円"
      ],
      "changed_at": "2026-10-02",
      "source_ids": [
        "s1"
      ]
    },
    {
      "field": "exchange_rates",
      "before": null,
      "after": [
        "4円パチンコ 28玉",
        "1.11円パチンコ 100.9玉",
        "21.73円スロット 5.15枚",
        "5円スロット 22.4枚"
      ],
      "changed_at": "2026-10-02",
      "source_ids": [
        "s1"
      ]
    },
    {
      "field": "prize_exchange",
      "before": null,
      "after": "線路側入り口を出て右手すぐ（大きなTUCの看板あり）",
      "changed_at": "2026-10-02",
      "source_ids": [
        "s1"
      ]
    },
    {
      "field": "opened_on",
      "before": null,
      "after": "2023年1月6日",
      "changed_at": "2026-10-02",
      "source_ids": [
        "s1"
      ]
    },
    {
      "field": "event_days",
      "before": null,
      "after": "1日、6日、11日、15日、22日、月日ゾロ目",
      "changed_at": "2026-10-02",
      "source_ids": [
        "s1"
      ]
    },
    {
      "field": "anniversary_days",
      "before": null,
      "after": "1月6日",
      "changed_at": "2026-10-02",
      "source_ids": [
        "s1"
      ]
    }
  ]
}
