{
  "$schema": "./schema.json",
  "id": "bellagio_nishinakajima",
  "name": "ベラジオ西中島店",
  "region": "大阪府",
  "area": "西中島南方",
  "sheet_store_name": "ベラジオ西中島店",
  "updated_at": "2026-09-25",
  "sources": [
    {
      "id": "s1",
      "name": "ベラジオ西中島店 店舗ページ（公式LP）",
      "url": "https://bellagio03.lp-dokidoki.com/",
      "reliability": "公式",
      "checked_at": "2026-09-25"
    },
    {
      "id": "s2",
      "name": "P-WORLD ベラジオ西中島店",
      "url": "https://www.p-world.co.jp/osaka/bellagio-nishinaka.htm",
      "reliability": "ポータル",
      "checked_at": "2026-09-25"
    }
  ],
  "info": {
    "city": {
      "value": "大阪市淀川区",
      "status": "確認済",
      "source_ids": [
        "s1"
      ]
    },
    "address": {
      "value": "大阪府大阪市淀川区西中島5-10-6",
      "status": "確認済",
      "source_ids": [
        "s1"
      ]
    },
    "phone": {
      "value": "06-6838-6600",
      "status": "未確認",
      "source_ids": [
        "s2"
      ]
    },
    "hours": {
      "value": "10:00～22:40",
      "status": "確認済",
      "source_ids": [
        "s1"
      ]
    },
    "entry": {
      "value": null,
      "status": "不明",
      "source_ids": []
    },
    "total_units": {
      "value": null,
      "status": "不明",
      "source_ids": []
    },
    "pachinko_units": {
      "value": 188,
      "status": "未確認",
      "source_ids": [
        "s2"
      ]
    },
    "slot_units": {
      "value": 272,
      "status": "未確認",
      "source_ids": [
        "s2"
      ]
    },
    "rates": {
      "value": [
        "4円パチンコ 188台",
        "20円スロット 272台"
      ],
      "status": "未確認",
      "source_ids": [
        "s2"
      ]
    },
    "exchange_rates": {
      "value": null,
      "status": "不明",
      "source_ids": []
    },
    "replay_limit": {
      "value": null,
      "status": "不明",
      "source_ids": []
    },
    "prize_exchange": {
      "value": null,
      "status": "不明",
      "source_ids": []
    },
    "parking": {
      "value": "115台",
      "status": "未確認",
      "source_ids": [
        "s2"
      ]
    },
    "access": {
      "value": "地下鉄御堂筋線「西中島南方駅」から徒歩5分、JR新大阪駅から徒歩5分",
      "status": "確認済",
      "source_ids": [
        "s1"
      ]
    },
    "official_url": {
      "value": "https://bellagio03.lp-dokidoki.com/",
      "status": "確認済",
      "source_ids": [
        "s1"
      ]
    },
    "sns": {
      "value": null,
      "status": "不明",
      "source_ids": []
    },
    "line": {
      "value": null,
      "status": "不明",
      "source_ids": []
    },
    "opened_on": {
      "value": null,
      "status": "不明",
      "source_ids": []
    },
    "features": {
      "value": [
        "Wi-Fi完備",
        "喫煙エリア完備",
        "カード式会員",
        "現金還玉対応"
      ],
      "status": "未確認",
      "source_ids": [
        "s2"
      ]
    },
    "installed_machines": {
      "value": null,
      "status": "不明",
      "source_ids": []
    },
    "event_days": {
      "value": null,
      "status": "不明",
      "source_ids": []
    },
    "anniversary_days": {
      "value": null,
      "status": "不明",
      "source_ids": []
    },
    "special_days": {
      "value": null,
      "status": "不明",
      "source_ids": []
    },
    "new_machines": {
      "value": null,
      "status": "不明",
      "source_ids": []
    },
    "notices": {
      "value": null,
      "status": "不明",
      "source_ids": []
    }
  },
  "history": [
    {
      "field": "city",
      "before": null,
      "after": "大阪市淀川区",
      "changed_at": "2026-09-25",
      "source_ids": [
        "s1"
      ]
    },
    {
      "field": "address",
      "before": null,
      "after": "大阪府大阪市淀川区西中島5-10-6",
      "changed_at": "2026-09-25",
      "source_ids": [
        "s1"
      ]
    },
    {
      "field": "hours",
      "before": null,
      "after": "10:00～22:40",
      "changed_at": "2026-09-25",
      "source_ids": [
        "s1"
      ]
    },
    {
      "field": "access",
      "before": null,
      "after": "地下鉄御堂筋線「西中島南方駅」から徒歩5分、JR新大阪駅から徒歩5分",
      "changed_at": "2026-09-25",
      "source_ids": [
        "s1"
      ]
    },
    {
      "field": "official_url",
      "before": null,
      "after": "https://bellagio03.lp-dokidoki.com/",
      "changed_at": "2026-09-25",
      "source_ids": [
        "s1"
      ]
    },
    {
      "field": "phone",
      "before": null,
      "after": "06-6838-6600",
      "changed_at": "2026-09-25",
      "source_ids": [
        "s2"
      ]
    },
    {
      "field": "pachinko_units",
      "before": null,
      "after": 188,
      "changed_at": "2026-09-25",
      "source_ids": [
        "s2"
      ]
    },
    {
      "field": "slot_units",
      "before": null,
      "after": 272,
      "changed_at": "2026-09-25",
      "source_ids": [
        "s2"
      ]
    },
    {
      "field": "rates",
      "before": null,
      "after": [
        "4円パチンコ 188台",
        "20円スロット 272台"
      ],
      "changed_at": "2026-09-25",
      "source_ids": [
        "s2"
      ]
    },
    {
      "field": "parking",
      "before": null,
      "after": "115台",
      "changed_at": "2026-09-25",
      "source_ids": [
        "s2"
      ]
    },
    {
      "field": "features",
      "before": null,
      "after": [
        "Wi-Fi完備",
        "喫煙エリア完備",
        "カード式会員",
        "現金還玉対応"
      ],
      "changed_at": "2026-09-25",
      "source_ids": [
        "s2"
      ]
    }
  ]
}
