{
  "$schema": "./schema.json",
  "id": "yasuda_nishiikebukuro_6",
  "name": "やすだ西池袋６号店",
  "region": "東京都",
  "area": "池袋",
  "sheet_store_name": "やすだ西池袋６号店",
  "updated_at": "2026-09-25",
  "sources": [
    {
      "id": "s1",
      "name": "みんぱち やすだ西池袋６号店",
      "url": "https://minpachi.com/yasuda-6/",
      "reliability": "ポータル",
      "checked_at": "2026-09-25"
    }
  ],
  "info": {
    "city": {
      "value": "豊島区",
      "status": "未確認",
      "source_ids": [
        "s1"
      ]
    },
    "address": {
      "value": "東京都豊島区西池袋1-36-3",
      "status": "未確認",
      "source_ids": [
        "s1"
      ]
    },
    "phone": {
      "value": null,
      "status": "不明",
      "source_ids": []
    },
    "hours": {
      "value": "10:00～23:00",
      "status": "未確認",
      "source_ids": [
        "s1"
      ]
    },
    "entry": {
      "value": [
        "整理券あり（会員カード不要）",
        "配布方法: モバイル抽選（入場くんオンライン）",
        "配布時間: 9:30",
        "当日9:30まで参加受付、9:45番号表示、9:50再整列、10:00入場開始"
      ],
      "status": "未確認",
      "source_ids": [
        "s1"
      ]
    },
    "total_units": {
      "value": null,
      "status": "不明",
      "source_ids": []
    },
    "pachinko_units": {
      "value": 241,
      "status": "未確認",
      "source_ids": [
        "s1"
      ]
    },
    "slot_units": {
      "value": 110,
      "status": "未確認",
      "source_ids": [
        "s1"
      ]
    },
    "rates": {
      "value": [
        "パチンコ 4円 / 1円",
        "スロット 21.73円"
      ],
      "status": "未確認",
      "source_ids": [
        "s1"
      ]
    },
    "exchange_rates": {
      "value": [
        "4円パチンコ 28玉",
        "1円パチンコ 112玉",
        "21.73円スロット 5.2枚"
      ],
      "status": "未確認",
      "source_ids": [
        "s1"
      ]
    },
    "replay_limit": {
      "value": [
        "4円パチンコ 2500玉",
        "1円パチンコ 2500玉",
        "21.73円スロット 460枚"
      ],
      "status": "未確認",
      "source_ids": [
        "s1"
      ]
    },
    "prize_exchange": {
      "value": "店舗駐輪場のある裏口を出て正面",
      "status": "未確認",
      "source_ids": [
        "s1"
      ]
    },
    "parking": {
      "value": null,
      "status": "不明",
      "source_ids": []
    },
    "access": {
      "value": null,
      "status": "不明",
      "source_ids": []
    },
    "official_url": {
      "value": null,
      "status": "不明",
      "source_ids": []
    },
    "sns": {
      "value": null,
      "status": "不明",
      "source_ids": []
    },
    "line": {
      "value": null,
      "status": "不明",
      "source_ids": []
    },
    "opened_on": {
      "value": "1973年3月1日",
      "status": "未確認",
      "source_ids": [
        "s1"
      ]
    },
    "features": {
      "value": null,
      "status": "不明",
      "source_ids": []
    },
    "installed_machines": {
      "value": null,
      "status": "不明",
      "source_ids": []
    },
    "event_days": {
      "value": "6のつく日",
      "status": "未確認",
      "source_ids": [
        "s1"
      ]
    },
    "anniversary_days": {
      "value": "3月1日",
      "status": "未確認",
      "source_ids": [
        "s1"
      ]
    },
    "special_days": {
      "value": null,
      "status": "不明",
      "source_ids": []
    },
    "new_machines": {
      "value": null,
      "status": "不明",
      "source_ids": []
    },
    "notices": {
      "value": null,
      "status": "不明",
      "source_ids": []
    }
  },
  "history": [
    {
      "field": "city",
      "before": null,
      "after": "豊島区",
      "changed_at": "2026-09-25",
      "source_ids": [
        "s1"
      ]
    },
    {
      "field": "address",
      "before": null,
      "after": "東京都豊島区西池袋1-36-3",
      "changed_at": "2026-09-25",
      "source_ids": [
        "s1"
      ]
    },
    {
      "field": "hours",
      "before": null,
      "after": "10:00～23:00",
      "changed_at": "2026-09-25",
      "source_ids": [
        "s1"
      ]
    },
    {
      "field": "entry",
      "before": null,
      "after": [
        "整理券あり（会員カード不要）",
        "配布方法: モバイル抽選（入場くんオンライン）",
        "配布時間: 9:30",
        "当日9:30まで参加受付、9:45番号表示、9:50再整列、10:00入場開始"
      ],
      "changed_at": "2026-09-25",
      "source_ids": [
        "s1"
      ]
    },
    {
      "field": "pachinko_units",
      "before": null,
      "after": 241,
      "changed_at": "2026-09-25",
      "source_ids": [
        "s1"
      ]
    },
    {
      "field": "slot_units",
      "before": null,
      "after": 110,
      "changed_at": "2026-09-25",
      "source_ids": [
        "s1"
      ]
    },
    {
      "field": "rates",
      "before": null,
      "after": [
        "パチンコ 4円 / 1円",
        "スロット 21.73円"
      ],
      "changed_at": "2026-09-25",
      "source_ids": [
        "s1"
      ]
    },
    {
      "field": "exchange_rates",
      "before": null,
      "after": [
        "4円パチンコ 28玉",
        "1円パチンコ 112玉",
        "21.73円スロット 5.2枚"
      ],
      "changed_at": "2026-09-25",
      "source_ids": [
        "s1"
      ]
    },
    {
      "field": "replay_limit",
      "before": null,
      "after": [
        "4円パチンコ 2500玉",
        "1円パチンコ 2500玉",
        "21.73円スロット 460枚"
      ],
      "changed_at": "2026-09-25",
      "source_ids": [
        "s1"
      ]
    },
    {
      "field": "prize_exchange",
      "before": null,
      "after": "店舗駐輪場のある裏口を出て正面",
      "changed_at": "2026-09-25",
      "source_ids": [
        "s1"
      ]
    },
    {
      "field": "opened_on",
      "before": null,
      "after": "1973年3月1日",
      "changed_at": "2026-09-25",
      "source_ids": [
        "s1"
      ]
    },
    {
      "field": "event_days",
      "before": null,
      "after": "6のつく日",
      "changed_at": "2026-09-25",
      "source_ids": [
        "s1"
      ]
    },
    {
      "field": "anniversary_days",
      "before": null,
      "after": "3月1日",
      "changed_at": "2026-09-25",
      "source_ids": [
        "s1"
      ]
    }
  ]
}
