{
  "$schema": "./schema.json",
  "id": "asahi_hatagaya2",
  "name": "アサヒ幡ヶ谷2号店",
  "region": "東京都",
  "area": "幡ヶ谷",
  "sheet_store_name": "アサヒ幡ヶ谷2号店",
  "updated_at": "2026-10-02",
  "sources": [
    {
      "id": "s1",
      "name": "みんぱち アサヒ幡ヶ谷2号店",
      "url": "https://minpachi.com/%E3%82%A2%E3%82%B5%E3%83%92%E5%B9%A1%E3%83%B6%E8%B0%B72%E5%8F%B7%E5%BA%97/",
      "reliability": "ポータル",
      "checked_at": "2026-10-02"
    }
  ],
  "info": {
    "city": {
      "value": "渋谷区",
      "status": "未確認",
      "source_ids": [
        "s1"
      ]
    },
    "address": {
      "value": "東京都渋谷区幡ヶ谷2丁目13番4号 幡ヶ谷中央ビル地下1階",
      "status": "未確認",
      "source_ids": [
        "s1"
      ]
    },
    "phone": {
      "value": null,
      "status": "不明",
      "source_ids": []
    },
    "hours": {
      "value": "10:00～22:50",
      "status": "未確認",
      "source_ids": [
        "s1"
      ]
    },
    "entry": {
      "value": [
        "整理券あり（会員カード不要）",
        "抽選 9:40"
      ],
      "status": "未確認",
      "source_ids": [
        "s1"
      ]
    },
    "total_units": {
      "value": null,
      "status": "不明",
      "source_ids": []
    },
    "pachinko_units": {
      "value": 136,
      "status": "未確認",
      "source_ids": [
        "s1"
      ]
    },
    "slot_units": {
      "value": 125,
      "status": "未確認",
      "source_ids": [
        "s1"
      ]
    },
    "rates": {
      "value": [
        "パチンコ 4円 / 1円",
        "スロット 20円"
      ],
      "status": "未確認",
      "source_ids": [
        "s1"
      ]
    },
    "exchange_rates": {
      "value": [
        "4円パチンコ 28玉",
        "1円パチンコ 112玉",
        "20円スロット 5.6枚"
      ],
      "status": "未確認",
      "source_ids": [
        "s1"
      ]
    },
    "replay_limit": {
      "value": null,
      "status": "不明",
      "source_ids": []
    },
    "prize_exchange": {
      "value": "駅に繋がっている出口を出て、階段を上がった右手にあります。",
      "status": "未確認",
      "source_ids": [
        "s1"
      ]
    },
    "parking": {
      "value": null,
      "status": "不明",
      "source_ids": []
    },
    "access": {
      "value": null,
      "status": "不明",
      "source_ids": []
    },
    "official_url": {
      "value": null,
      "status": "不明",
      "source_ids": []
    },
    "sns": {
      "value": null,
      "status": "不明",
      "source_ids": []
    },
    "line": {
      "value": null,
      "status": "不明",
      "source_ids": []
    },
    "opened_on": {
      "value": "2013年12月27日",
      "status": "未確認",
      "source_ids": [
        "s1"
      ]
    },
    "features": {
      "value": null,
      "status": "不明",
      "source_ids": []
    },
    "installed_machines": {
      "value": null,
      "status": "不明",
      "source_ids": []
    },
    "event_days": {
      "value": "2のつく日",
      "status": "未確認",
      "source_ids": [
        "s1"
      ]
    },
    "anniversary_days": {
      "value": null,
      "status": "不明",
      "source_ids": []
    },
    "special_days": {
      "value": [
        "7のつく日⇒無双・絆・ジャグラー推し",
        "1のつく日⇒競合店対策日"
      ],
      "status": "未確認",
      "source_ids": [
        "s1"
      ]
    },
    "new_machines": {
      "value": null,
      "status": "不明",
      "source_ids": []
    },
    "notices": {
      "value": null,
      "status": "不明",
      "source_ids": []
    }
  },
  "history": [
    {
      "field": "city",
      "before": null,
      "after": "渋谷区",
      "changed_at": "2026-10-02",
      "source_ids": [
        "s1"
      ]
    },
    {
      "field": "address",
      "before": null,
      "after": "東京都渋谷区幡ヶ谷2丁目13番4号 幡ヶ谷中央ビル地下1階",
      "changed_at": "2026-10-02",
      "source_ids": [
        "s1"
      ]
    },
    {
      "field": "hours",
      "before": null,
      "after": "10:00～22:50",
      "changed_at": "2026-10-02",
      "source_ids": [
        "s1"
      ]
    },
    {
      "field": "entry",
      "before": null,
      "after": [
        "整理券あり（会員カード不要）",
        "抽選 9:40"
      ],
      "changed_at": "2026-10-02",
      "source_ids": [
        "s1"
      ]
    },
    {
      "field": "pachinko_units",
      "before": null,
      "after": 136,
      "changed_at": "2026-10-02",
      "source_ids": [
        "s1"
      ]
    },
    {
      "field": "slot_units",
      "before": null,
      "after": 125,
      "changed_at": "2026-10-02",
      "source_ids": [
        "s1"
      ]
    },
    {
      "field": "rates",
      "before": null,
      "after": [
        "パチンコ 4円 / 1円",
        "スロット 20円"
      ],
      "changed_at": "2026-10-02",
      "source_ids": [
        "s1"
      ]
    },
    {
      "field": "exchange_rates",
      "before": null,
      "after": [
        "4円パチンコ 28玉",
        "1円パチンコ 112玉",
        "20円スロット 5.6枚"
      ],
      "changed_at": "2026-10-02",
      "source_ids": [
        "s1"
      ]
    },
    {
      "field": "prize_exchange",
      "before": null,
      "after": "駅に繋がっている出口を出て、階段を上がった右手にあります。",
      "changed_at": "2026-10-02",
      "source_ids": [
        "s1"
      ]
    },
    {
      "field": "opened_on",
      "before": null,
      "after": "2013年12月27日",
      "changed_at": "2026-10-02",
      "source_ids": [
        "s1"
      ]
    },
    {
      "field": "event_days",
      "before": null,
      "after": "2のつく日",
      "changed_at": "2026-10-02",
      "source_ids": [
        "s1"
      ]
    },
    {
      "field": "special_days",
      "before": null,
      "after": [
        "7のつく日⇒無双・絆・ジャグラー推し",
        "1のつく日⇒競合店対策日"
      ],
      "changed_at": "2026-10-02",
      "source_ids": [
        "s1"
      ]
    }
  ]
}
