{
  "$schema": "./schema.json",
  "id": "kings_akabane",
  "name": "キングス",
  "region": "東京都",
  "area": "赤羽",
  "sheet_store_name": "キングス",
  "updated_at": "2026-09-30",
  "sources": [
    {
      "id": "s1",
      "name": "みんぱち キングス",
      "url": "https://minpachi.com/%e3%82%ad%e3%83%b3%e3%82%b0%e3%82%b9/",
      "reliability": "ポータル",
      "checked_at": "2026-09-30"
    }
  ],
  "info": {
    "city": {
      "value": "北区",
      "status": "未確認",
      "source_ids": [
        "s1"
      ]
    },
    "address": {
      "value": "東京都北区赤羽南1-7-2",
      "status": "未確認",
      "source_ids": [
        "s1"
      ]
    },
    "phone": {
      "value": null,
      "status": "不明",
      "source_ids": []
    },
    "hours": {
      "value": "10:00〜22:50",
      "status": "未確認",
      "source_ids": [
        "s1"
      ]
    },
    "entry": {
      "value": [
        "整理券あり（会員カード優先）",
        "配布方法: 並び順",
        "配布時間: 9:50"
      ],
      "status": "未確認",
      "source_ids": [
        "s1"
      ]
    },
    "total_units": {
      "value": null,
      "status": "不明",
      "source_ids": []
    },
    "pachinko_units": {
      "value": 279,
      "status": "未確認",
      "source_ids": [
        "s1"
      ]
    },
    "slot_units": {
      "value": null,
      "status": "不明",
      "source_ids": []
    },
    "rates": {
      "value": [
        "パチンコ 4円 / 1円"
      ],
      "status": "未確認",
      "source_ids": [
        "s1"
      ]
    },
    "exchange_rates": {
      "value": [
        "4円パチンコ 28玉",
        "1円パチンコ 112玉"
      ],
      "status": "未確認",
      "source_ids": [
        "s1"
      ]
    },
    "replay_limit": {
      "value": null,
      "status": "不明",
      "source_ids": []
    },
    "prize_exchange": {
      "value": "店舗裏側出口（駅とは反対側）を右に進んですぐ右側、店舗から2軒隣の一軒家",
      "status": "未確認",
      "source_ids": [
        "s1"
      ]
    },
    "parking": {
      "value": null,
      "status": "不明",
      "source_ids": []
    },
    "access": {
      "value": null,
      "status": "不明",
      "source_ids": []
    },
    "official_url": {
      "value": null,
      "status": "不明",
      "source_ids": []
    },
    "sns": {
      "value": null,
      "status": "不明",
      "source_ids": []
    },
    "line": {
      "value": null,
      "status": "不明",
      "source_ids": []
    },
    "opened_on": {
      "value": "2006年12月20日",
      "status": "未確認",
      "source_ids": [
        "s1"
      ]
    },
    "features": {
      "value": null,
      "status": "不明",
      "source_ids": []
    },
    "installed_machines": {
      "value": null,
      "status": "不明",
      "source_ids": []
    },
    "event_days": {
      "value": null,
      "status": "不明",
      "source_ids": []
    },
    "anniversary_days": {
      "value": "12月20日",
      "status": "未確認",
      "source_ids": [
        "s1"
      ]
    },
    "special_days": {
      "value": null,
      "status": "不明",
      "source_ids": []
    },
    "new_machines": {
      "value": null,
      "status": "不明",
      "source_ids": []
    },
    "notices": {
      "value": null,
      "status": "不明",
      "source_ids": []
    }
  },
  "history": [
    {
      "field": "city",
      "before": null,
      "after": "北区",
      "changed_at": "2026-09-30",
      "source_ids": [
        "s1"
      ]
    },
    {
      "field": "address",
      "before": null,
      "after": "東京都北区赤羽南1-7-2",
      "changed_at": "2026-09-30",
      "source_ids": [
        "s1"
      ]
    },
    {
      "field": "hours",
      "before": null,
      "after": "10:00〜22:50",
      "changed_at": "2026-09-30",
      "source_ids": [
        "s1"
      ]
    },
    {
      "field": "entry",
      "before": null,
      "after": [
        "整理券あり（会員カード優先）",
        "配布方法: 並び順",
        "配布時間: 9:50"
      ],
      "changed_at": "2026-09-30",
      "source_ids": [
        "s1"
      ]
    },
    {
      "field": "pachinko_units",
      "before": null,
      "after": 279,
      "changed_at": "2026-09-30",
      "source_ids": [
        "s1"
      ]
    },
    {
      "field": "rates",
      "before": null,
      "after": [
        "パチンコ 4円 / 1円"
      ],
      "changed_at": "2026-09-30",
      "source_ids": [
        "s1"
      ]
    },
    {
      "field": "exchange_rates",
      "before": null,
      "after": [
        "4円パチンコ 28玉",
        "1円パチンコ 112玉"
      ],
      "changed_at": "2026-09-30",
      "source_ids": [
        "s1"
      ]
    },
    {
      "field": "prize_exchange",
      "before": null,
      "after": "店舗裏側出口（駅とは反対側）を右に進んですぐ右側、店舗から2軒隣の一軒家",
      "changed_at": "2026-09-30",
      "source_ids": [
        "s1"
      ]
    },
    {
      "field": "opened_on",
      "before": null,
      "after": "2006年12月20日",
      "changed_at": "2026-09-30",
      "source_ids": [
        "s1"
      ]
    },
    {
      "field": "anniversary_days",
      "before": null,
      "after": "12月20日",
      "changed_at": "2026-09-30",
      "source_ids": [
        "s1"
      ]
    }
  ]
}
