{
  "$schema": "./schema.json",
  "id": "palazzo_kasai",
  "name": "パラッツォ葛西店",
  "region": "東京都",
  "area": "葛西",
  "sheet_store_name": "パラッツォ葛西店",
  "updated_at": "2026-10-02",
  "sources": [
    {
      "id": "s1",
      "name": "みんぱち パラッツォ葛西店",
      "url": "https://minpachi.com/palazzo-katsu/",
      "reliability": "ポータル",
      "checked_at": "2026-10-02"
    }
  ],
  "info": {
    "city": {
      "value": "江戸川区",
      "status": "未確認",
      "source_ids": [
        "s1"
      ]
    },
    "address": {
      "value": "東京都江戸川区中葛西5-42-6",
      "status": "未確認",
      "source_ids": [
        "s1"
      ]
    },
    "phone": {
      "value": null,
      "status": "不明",
      "source_ids": []
    },
    "hours": {
      "value": "10:00～22:45",
      "status": "未確認",
      "source_ids": [
        "s1"
      ]
    },
    "entry": {
      "value": [
        "抽選（会員カード不要）",
        "9:30 抽選 / 9:50 再整列 / 10:00 入場"
      ],
      "status": "未確認",
      "source_ids": [
        "s1"
      ]
    },
    "total_units": {
      "value": null,
      "status": "不明",
      "source_ids": []
    },
    "pachinko_units": {
      "value": 416,
      "status": "未確認",
      "source_ids": [
        "s1"
      ]
    },
    "slot_units": {
      "value": 346,
      "status": "未確認",
      "source_ids": [
        "s1"
      ]
    },
    "rates": {
      "value": [
        "パチンコ 4円 / 1円",
        "スロット 21.73円"
      ],
      "status": "未確認",
      "source_ids": [
        "s1"
      ]
    },
    "exchange_rates": {
      "value": [
        "4円パチンコ 28玉",
        "1円パチンコ 112玉",
        "21.73円スロット 5.16枚"
      ],
      "status": "未確認",
      "source_ids": [
        "s1"
      ]
    },
    "replay_limit": {
      "value": null,
      "status": "不明",
      "source_ids": []
    },
    "prize_exchange": {
      "value": "立体駐車場側の出口をでて道路挟んで反対側にあるTUC",
      "status": "未確認",
      "source_ids": [
        "s1"
      ]
    },
    "parking": {
      "value": null,
      "status": "不明",
      "source_ids": []
    },
    "access": {
      "value": null,
      "status": "不明",
      "source_ids": []
    },
    "official_url": {
      "value": null,
      "status": "不明",
      "source_ids": []
    },
    "sns": {
      "value": null,
      "status": "不明",
      "source_ids": []
    },
    "line": {
      "value": null,
      "status": "不明",
      "source_ids": []
    },
    "opened_on": {
      "value": "1998年11月23日",
      "status": "未確認",
      "source_ids": [
        "s1"
      ]
    },
    "features": {
      "value": null,
      "status": "不明",
      "source_ids": []
    },
    "installed_machines": {
      "value": null,
      "status": "不明",
      "source_ids": []
    },
    "event_days": {
      "value": "2のつく日、8のつく日",
      "status": "未確認",
      "source_ids": [
        "s1"
      ]
    },
    "anniversary_days": {
      "value": null,
      "status": "不明",
      "source_ids": []
    },
    "special_days": {
      "value": null,
      "status": "不明",
      "source_ids": []
    },
    "new_machines": {
      "value": null,
      "status": "不明",
      "source_ids": []
    },
    "notices": {
      "value": null,
      "status": "不明",
      "source_ids": []
    }
  },
  "history": [
    {
      "field": "city",
      "before": null,
      "after": "江戸川区",
      "changed_at": "2026-10-02",
      "source_ids": [
        "s1"
      ]
    },
    {
      "field": "address",
      "before": null,
      "after": "東京都江戸川区中葛西5-42-6",
      "changed_at": "2026-10-02",
      "source_ids": [
        "s1"
      ]
    },
    {
      "field": "hours",
      "before": null,
      "after": "10:00～22:45",
      "changed_at": "2026-10-02",
      "source_ids": [
        "s1"
      ]
    },
    {
      "field": "entry",
      "before": null,
      "after": [
        "抽選（会員カード不要）",
        "9:30 抽選 / 9:50 再整列 / 10:00 入場"
      ],
      "changed_at": "2026-10-02",
      "source_ids": [
        "s1"
      ]
    },
    {
      "field": "pachinko_units",
      "before": null,
      "after": 416,
      "changed_at": "2026-10-02",
      "source_ids": [
        "s1"
      ]
    },
    {
      "field": "slot_units",
      "before": null,
      "after": 346,
      "changed_at": "2026-10-02",
      "source_ids": [
        "s1"
      ]
    },
    {
      "field": "rates",
      "before": null,
      "after": [
        "パチンコ 4円 / 1円",
        "スロット 21.73円"
      ],
      "changed_at": "2026-10-02",
      "source_ids": [
        "s1"
      ]
    },
    {
      "field": "exchange_rates",
      "before": null,
      "after": [
        "4円パチンコ 28玉",
        "1円パチンコ 112玉",
        "21.73円スロット 5.16枚"
      ],
      "changed_at": "2026-10-02",
      "source_ids": [
        "s1"
      ]
    },
    {
      "field": "prize_exchange",
      "before": null,
      "after": "立体駐車場側の出口をでて道路挟んで反対側にあるTUC",
      "changed_at": "2026-10-02",
      "source_ids": [
        "s1"
      ]
    },
    {
      "field": "opened_on",
      "before": null,
      "after": "1998年11月23日",
      "changed_at": "2026-10-02",
      "source_ids": [
        "s1"
      ]
    },
    {
      "field": "event_days",
      "before": null,
      "after": "2のつく日、8のつく日",
      "changed_at": "2026-10-02",
      "source_ids": [
        "s1"
      ]
    }
  ]
}
