{
  "$schema": "./schema.json",
  "id": "concert_f_narimasu",
  "name": "コンサートホールエフ成増",
  "region": "東京都",
  "area": "成増",
  "sheet_store_name": "コンサートホールエフ成増",
  "updated_at": "2026-10-02",
  "sources": [
    {
      "id": "s1",
      "name": "みんぱち コンサートホールエフ成増",
      "url": "https://minpachi.com/concert-f-narimasu/",
      "reliability": "ポータル",
      "checked_at": "2026-10-02"
    }
  ],
  "info": {
    "city": {
      "value": "板橋区",
      "status": "未確認",
      "source_ids": [
        "s1"
      ]
    },
    "address": {
      "value": "東京都板橋区成増2-21-2 MEGAドン・キホーテ成増店B1F",
      "status": "未確認",
      "source_ids": [
        "s1"
      ]
    },
    "phone": {
      "value": null,
      "status": "不明",
      "source_ids": []
    },
    "hours": {
      "value": "10:00～23:00",
      "status": "未確認",
      "source_ids": [
        "s1"
      ]
    },
    "entry": {
      "value": [
        "整理券あり（会員カード不要）",
        "モバイル抽選"
      ],
      "status": "未確認",
      "source_ids": [
        "s1"
      ]
    },
    "total_units": {
      "value": null,
      "status": "不明",
      "source_ids": []
    },
    "pachinko_units": {
      "value": 411,
      "status": "未確認",
      "source_ids": [
        "s1"
      ]
    },
    "slot_units": {
      "value": 493,
      "status": "未確認",
      "source_ids": [
        "s1"
      ]
    },
    "rates": {
      "value": [
        "パチンコ 4円 / 1.12円",
        "スロット 21.73円 / 5.61円"
      ],
      "status": "未確認",
      "source_ids": [
        "s1"
      ]
    },
    "exchange_rates": {
      "value": [
        "4円パチンコ 28玉",
        "1.12円パチンコ 100玉",
        "21.73円スロット 5.2枚",
        "5.61円スロット 20枚"
      ],
      "status": "未確認",
      "source_ids": [
        "s1"
      ]
    },
    "replay_limit": {
      "value": null,
      "status": "不明",
      "source_ids": []
    },
    "prize_exchange": {
      "value": "MEGAドン・キホーテ成増店の１階正面入口左側",
      "status": "未確認",
      "source_ids": [
        "s1"
      ]
    },
    "parking": {
      "value": null,
      "status": "不明",
      "source_ids": []
    },
    "access": {
      "value": null,
      "status": "不明",
      "source_ids": []
    },
    "official_url": {
      "value": null,
      "status": "不明",
      "source_ids": []
    },
    "sns": {
      "value": null,
      "status": "不明",
      "source_ids": []
    },
    "line": {
      "value": null,
      "status": "不明",
      "source_ids": []
    },
    "opened_on": {
      "value": "2024年4月27日",
      "status": "未確認",
      "source_ids": [
        "s1"
      ]
    },
    "features": {
      "value": null,
      "status": "不明",
      "source_ids": []
    },
    "installed_machines": {
      "value": null,
      "status": "不明",
      "source_ids": []
    },
    "event_days": {
      "value": "1のつく日、2のつく日、7のつく日",
      "status": "未確認",
      "source_ids": [
        "s1"
      ]
    },
    "anniversary_days": {
      "value": null,
      "status": "不明",
      "source_ids": []
    },
    "special_days": {
      "value": null,
      "status": "不明",
      "source_ids": []
    },
    "new_machines": {
      "value": null,
      "status": "不明",
      "source_ids": []
    },
    "notices": {
      "value": null,
      "status": "不明",
      "source_ids": []
    }
  },
  "history": [
    {
      "field": "city",
      "before": null,
      "after": "板橋区",
      "changed_at": "2026-10-02",
      "source_ids": [
        "s1"
      ]
    },
    {
      "field": "address",
      "before": null,
      "after": "東京都板橋区成増2-21-2 MEGAドン・キホーテ成増店B1F",
      "changed_at": "2026-10-02",
      "source_ids": [
        "s1"
      ]
    },
    {
      "field": "hours",
      "before": null,
      "after": "10:00～23:00",
      "changed_at": "2026-10-02",
      "source_ids": [
        "s1"
      ]
    },
    {
      "field": "entry",
      "before": null,
      "after": [
        "整理券あり（会員カード不要）",
        "モバイル抽選"
      ],
      "changed_at": "2026-10-02",
      "source_ids": [
        "s1"
      ]
    },
    {
      "field": "pachinko_units",
      "before": null,
      "after": 411,
      "changed_at": "2026-10-02",
      "source_ids": [
        "s1"
      ]
    },
    {
      "field": "slot_units",
      "before": null,
      "after": 493,
      "changed_at": "2026-10-02",
      "source_ids": [
        "s1"
      ]
    },
    {
      "field": "rates",
      "before": null,
      "after": [
        "パチンコ 4円 / 1.12円",
        "スロット 21.73円 / 5.61円"
      ],
      "changed_at": "2026-10-02",
      "source_ids": [
        "s1"
      ]
    },
    {
      "field": "exchange_rates",
      "before": null,
      "after": [
        "4円パチンコ 28玉",
        "1.12円パチンコ 100玉",
        "21.73円スロット 5.2枚",
        "5.61円スロット 20枚"
      ],
      "changed_at": "2026-10-02",
      "source_ids": [
        "s1"
      ]
    },
    {
      "field": "prize_exchange",
      "before": null,
      "after": "MEGAドン・キホーテ成増店の１階正面入口左側",
      "changed_at": "2026-10-02",
      "source_ids": [
        "s1"
      ]
    },
    {
      "field": "opened_on",
      "before": null,
      "after": "2024年4月27日",
      "changed_at": "2026-10-02",
      "source_ids": [
        "s1"
      ]
    },
    {
      "field": "event_days",
      "before": null,
      "after": "1のつく日、2のつく日、7のつく日",
      "changed_at": "2026-10-02",
      "source_ids": [
        "s1"
      ]
    }
  ]
}
