{
  "$schema": "./schema.json",
  "id": "yasuda7",
  "name": "YASUDA7",
  "region": "東京都",
  "area": "池袋",
  "sheet_store_name": "YASUDA7",
  "updated_at": "2026-09-25",
  "sources": [
    {
      "id": "s1",
      "name": "みんぱち YASUDA7",
      "url": "https://minpachi.com/yasuda-7/",
      "reliability": "ポータル",
      "checked_at": "2026-09-25"
    }
  ],
  "info": {
    "city": {
      "value": "豊島区",
      "status": "未確認",
      "source_ids": [
        "s1"
      ]
    },
    "address": {
      "value": "東京都豊島区東池袋1-42-3",
      "status": "未確認",
      "source_ids": [
        "s1"
      ]
    },
    "phone": {
      "value": null,
      "status": "不明",
      "source_ids": []
    },
    "hours": {
      "value": "10:00～23:00",
      "status": "未確認",
      "source_ids": [
        "s1"
      ]
    },
    "entry": {
      "value": [
        "整理券あり（会員カード不要）",
        "配布方法: 抽選",
        "配布時間: 9:35",
        "09:35 抽選開始／09:50 再整列／10:00 入場開始"
      ],
      "status": "未確認",
      "source_ids": [
        "s1"
      ]
    },
    "total_units": {
      "value": null,
      "status": "不明",
      "source_ids": []
    },
    "pachinko_units": {
      "value": null,
      "status": "不明",
      "source_ids": []
    },
    "slot_units": {
      "value": 338,
      "status": "未確認",
      "source_ids": [
        "s1"
      ]
    },
    "rates": {
      "value": [
        "スロット 21.73円 / 5円"
      ],
      "status": "未確認",
      "source_ids": [
        "s1"
      ]
    },
    "exchange_rates": {
      "value": [
        "21.73円スロット 5.2枚",
        "5円スロット 23枚"
      ],
      "status": "未確認",
      "source_ids": [
        "s1"
      ]
    },
    "replay_limit": {
      "value": null,
      "status": "不明",
      "source_ids": []
    },
    "prize_exchange": {
      "value": "1F出口を出たらすぐ正面",
      "status": "未確認",
      "source_ids": [
        "s1"
      ]
    },
    "parking": {
      "value": null,
      "status": "不明",
      "source_ids": []
    },
    "access": {
      "value": null,
      "status": "不明",
      "source_ids": []
    },
    "official_url": {
      "value": null,
      "status": "不明",
      "source_ids": []
    },
    "sns": {
      "value": null,
      "status": "不明",
      "source_ids": []
    },
    "line": {
      "value": null,
      "status": "不明",
      "source_ids": []
    },
    "opened_on": {
      "value": "1977年9月10日（屋号変更リニューアルオープン: 2025年8月1日）",
      "status": "未確認",
      "source_ids": [
        "s1"
      ]
    },
    "features": {
      "value": null,
      "status": "不明",
      "source_ids": []
    },
    "installed_machines": {
      "value": null,
      "status": "不明",
      "source_ids": []
    },
    "event_days": {
      "value": "7のつく日",
      "status": "未確認",
      "source_ids": [
        "s1"
      ]
    },
    "anniversary_days": {
      "value": "9月10日",
      "status": "未確認",
      "source_ids": [
        "s1"
      ]
    },
    "special_days": {
      "value": null,
      "status": "不明",
      "source_ids": []
    },
    "new_machines": {
      "value": null,
      "status": "不明",
      "source_ids": []
    },
    "notices": {
      "value": null,
      "status": "不明",
      "source_ids": []
    }
  },
  "history": [
    {
      "field": "city",
      "before": null,
      "after": "豊島区",
      "changed_at": "2026-09-25",
      "source_ids": [
        "s1"
      ]
    },
    {
      "field": "address",
      "before": null,
      "after": "東京都豊島区東池袋1-42-3",
      "changed_at": "2026-09-25",
      "source_ids": [
        "s1"
      ]
    },
    {
      "field": "hours",
      "before": null,
      "after": "10:00～23:00",
      "changed_at": "2026-09-25",
      "source_ids": [
        "s1"
      ]
    },
    {
      "field": "entry",
      "before": null,
      "after": [
        "整理券あり（会員カード不要）",
        "配布方法: 抽選",
        "配布時間: 9:35",
        "09:35 抽選開始／09:50 再整列／10:00 入場開始"
      ],
      "changed_at": "2026-09-25",
      "source_ids": [
        "s1"
      ]
    },
    {
      "field": "slot_units",
      "before": null,
      "after": 338,
      "changed_at": "2026-09-25",
      "source_ids": [
        "s1"
      ]
    },
    {
      "field": "rates",
      "before": null,
      "after": [
        "スロット 21.73円 / 5円"
      ],
      "changed_at": "2026-09-25",
      "source_ids": [
        "s1"
      ]
    },
    {
      "field": "exchange_rates",
      "before": null,
      "after": [
        "21.73円スロット 5.2枚",
        "5円スロット 23枚"
      ],
      "changed_at": "2026-09-25",
      "source_ids": [
        "s1"
      ]
    },
    {
      "field": "prize_exchange",
      "before": null,
      "after": "1F出口を出たらすぐ正面",
      "changed_at": "2026-09-25",
      "source_ids": [
        "s1"
      ]
    },
    {
      "field": "opened_on",
      "before": null,
      "after": "1977年9月10日（屋号変更リニューアルオープン: 2025年8月1日）",
      "changed_at": "2026-09-25",
      "source_ids": [
        "s1"
      ]
    },
    {
      "field": "event_days",
      "before": null,
      "after": "7のつく日",
      "changed_at": "2026-09-25",
      "source_ids": [
        "s1"
      ]
    },
    {
      "field": "anniversary_days",
      "before": null,
      "after": "9月10日",
      "changed_at": "2026-09-25",
      "source_ids": [
        "s1"
      ]
    }
  ]
}
