{
  "$schema": "./schema.json",
  "id": "rakuen_ikebukuro_gs",
  "name": "楽園池袋店グリーンサイド",
  "region": "東京都",
  "area": "池袋",
  "sheet_store_name": "楽園池袋店グリーンサイド",
  "updated_at": "2026-09-25",
  "sources": [
    {
      "id": "s1",
      "name": "みんぱち 楽園池袋店グリーンサイド",
      "url": "https://minpachi.com/rakuen-ikebukurogs/",
      "reliability": "ポータル",
      "checked_at": "2026-09-25"
    }
  ],
  "info": {
    "city": {
      "value": "豊島区",
      "status": "未確認",
      "source_ids": [
        "s1"
      ]
    },
    "address": {
      "value": "東京都豊島区南池袋1-26-8",
      "status": "未確認",
      "source_ids": [
        "s1"
      ]
    },
    "phone": {
      "value": null,
      "status": "不明",
      "source_ids": []
    },
    "hours": {
      "value": "10:00〜22:40",
      "status": "未確認",
      "source_ids": [
        "s1"
      ]
    },
    "entry": {
      "value": [
        "整理券あり（会員カード不要）",
        "配布方法: 抽選",
        "配布時間: 9:40",
        "9:40抽選、9:50再整列、10:00入場開始。場所はゲートウェイ。450名で打ち切り"
      ],
      "status": "未確認",
      "source_ids": [
        "s1"
      ]
    },
    "total_units": {
      "value": null,
      "status": "不明",
      "source_ids": []
    },
    "pachinko_units": {
      "value": 330,
      "status": "未確認",
      "source_ids": [
        "s1"
      ]
    },
    "slot_units": {
      "value": 371,
      "status": "未確認",
      "source_ids": [
        "s1"
      ]
    },
    "rates": {
      "value": [
        "パチンコ 4円 / 1円",
        "スロット 21.73円"
      ],
      "status": "未確認",
      "source_ids": [
        "s1"
      ]
    },
    "exchange_rates": {
      "value": [
        "4円パチンコ 28玉",
        "1円パチンコ 112玉",
        "21.73円スロット 5.16枚"
      ],
      "status": "未確認",
      "source_ids": [
        "s1"
      ]
    },
    "replay_limit": {
      "value": [
        "4円パチンコ 2500玉",
        "1円パチンコ 2500玉",
        "21.73円スロット 500枚"
      ],
      "status": "未確認",
      "source_ids": [
        "s1"
      ]
    },
    "prize_exchange": {
      "value": "景品カウンターすぐの出口を出て左手に進むとT·U·Cの看板あり。階段降りた地下が換金所",
      "status": "未確認",
      "source_ids": [
        "s1"
      ]
    },
    "parking": {
      "value": null,
      "status": "不明",
      "source_ids": []
    },
    "access": {
      "value": null,
      "status": "不明",
      "source_ids": []
    },
    "official_url": {
      "value": null,
      "status": "不明",
      "source_ids": []
    },
    "sns": {
      "value": null,
      "status": "不明",
      "source_ids": []
    },
    "line": {
      "value": null,
      "status": "不明",
      "source_ids": []
    },
    "opened_on": {
      "value": "2025年5月1日",
      "status": "未確認",
      "source_ids": [
        "s1"
      ]
    },
    "features": {
      "value": null,
      "status": "不明",
      "source_ids": []
    },
    "installed_machines": {
      "value": null,
      "status": "不明",
      "source_ids": []
    },
    "event_days": {
      "value": "11日、22日、月日ゾロ目",
      "status": "未確認",
      "source_ids": [
        "s1"
      ]
    },
    "anniversary_days": {
      "value": "5月1日",
      "status": "未確認",
      "source_ids": [
        "s1"
      ]
    },
    "special_days": {
      "value": null,
      "status": "不明",
      "source_ids": []
    },
    "new_machines": {
      "value": null,
      "status": "不明",
      "source_ids": []
    },
    "notices": {
      "value": null,
      "status": "不明",
      "source_ids": []
    }
  },
  "history": [
    {
      "field": "city",
      "before": null,
      "after": "豊島区",
      "changed_at": "2026-09-25",
      "source_ids": [
        "s1"
      ]
    },
    {
      "field": "address",
      "before": null,
      "after": "東京都豊島区南池袋1-26-8",
      "changed_at": "2026-09-25",
      "source_ids": [
        "s1"
      ]
    },
    {
      "field": "hours",
      "before": null,
      "after": "10:00〜22:40",
      "changed_at": "2026-09-25",
      "source_ids": [
        "s1"
      ]
    },
    {
      "field": "entry",
      "before": null,
      "after": [
        "整理券あり（会員カード不要）",
        "配布方法: 抽選",
        "配布時間: 9:40",
        "9:40抽選、9:50再整列、10:00入場開始。場所はゲートウェイ。450名で打ち切り"
      ],
      "changed_at": "2026-09-25",
      "source_ids": [
        "s1"
      ]
    },
    {
      "field": "pachinko_units",
      "before": null,
      "after": 330,
      "changed_at": "2026-09-25",
      "source_ids": [
        "s1"
      ]
    },
    {
      "field": "slot_units",
      "before": null,
      "after": 371,
      "changed_at": "2026-09-25",
      "source_ids": [
        "s1"
      ]
    },
    {
      "field": "rates",
      "before": null,
      "after": [
        "パチンコ 4円 / 1円",
        "スロット 21.73円"
      ],
      "changed_at": "2026-09-25",
      "source_ids": [
        "s1"
      ]
    },
    {
      "field": "exchange_rates",
      "before": null,
      "after": [
        "4円パチンコ 28玉",
        "1円パチンコ 112玉",
        "21.73円スロット 5.16枚"
      ],
      "changed_at": "2026-09-25",
      "source_ids": [
        "s1"
      ]
    },
    {
      "field": "replay_limit",
      "before": null,
      "after": [
        "4円パチンコ 2500玉",
        "1円パチンコ 2500玉",
        "21.73円スロット 500枚"
      ],
      "changed_at": "2026-09-25",
      "source_ids": [
        "s1"
      ]
    },
    {
      "field": "prize_exchange",
      "before": null,
      "after": "景品カウンターすぐの出口を出て左手に進むとT·U·Cの看板あり。階段降りた地下が換金所",
      "changed_at": "2026-09-25",
      "source_ids": [
        "s1"
      ]
    },
    {
      "field": "opened_on",
      "before": null,
      "after": "2025年5月1日",
      "changed_at": "2026-09-25",
      "source_ids": [
        "s1"
      ]
    },
    {
      "field": "event_days",
      "before": null,
      "after": "11日、22日、月日ゾロ目",
      "changed_at": "2026-09-25",
      "source_ids": [
        "s1"
      ]
    },
    {
      "field": "anniversary_days",
      "before": null,
      "after": "5月1日",
      "changed_at": "2026-09-25",
      "source_ids": [
        "s1"
      ]
    }
  ]
}
